{
  "cpu_only": true,
  "engine": "qwen3_tts",
  "environment": "/workspace/voiceover_qwen_cpu_py312",
  "executed": true,
  "inference_verified": false,
  "install_requested": true,
  "model_downloaded": false,
  "no_index": false,
  "notes": [
    "Package readiness is not proof of model weights availability or successful audio inference.",
    "Run the real inference smoke test in this virtual environment to verify generated audio."
  ],
  "package": "qwen-tts",
  "packages_to_install": [
    "torch==2.6.0+cpu",
    "torchaudio==2.6.0+cpu",
    "qwen-tts==0.1.1",
    "transformers==4.57.3",
    "accelerate==1.12.0",
    "gradio",
    "librosa",
    "soundfile",
    "sox",
    "onnxruntime",
    "einops"
  ],
  "python_executable": "/workspace/voiceover_test_venv/bin/python",
  "python_version": "3.12.3",
  "schema_version": 1,
  "status": "PACKAGE_READY",
  "steps": [
    {
      "id": "create_venv",
      "status": "PASS"
    },
    {
      "id": "install_cpu_torch",
      "returncode": 0,
      "status": "PASS",
      "stderr_tail": "",
      "stdout_tail": "Looking in indexes: https://download.pytorch.org/whl/cpu, https://pypi.org/simple\nCollecting torch==2.6.0+cpu\n  Downloading https://download-r2.pytorch.org/whl/cpu/torch-2.6.0%2Bcpu-cp312-cp312-linux_x86_64.whl.metadata (26 kB)\nCollecting torchaudio==2.6.0+cpu\n  Downloading https://download-r2.pytorch.org/whl/cpu/torchaudio-2.6.0%2Bcpu-cp312-cp312-linux_x86_64.whl.metadata (6.6 kB)\nCollecting filelock (from torch==2.6.0+cpu)\n  Downloading filelock-4.1.0-py3-none-any.whl.metadata (2.0 kB)\nCollecting typing-extensions>=4.10.0 (from torch==2.6.0+cpu)\n  Downloading typing_extensions-4.16.0-py3-none-any.whl.metadata (3.3 kB)\nCollecting networkx (from torch==2.6.0+cpu)\n  Downloading networkx-3.7-py3-none-any.whl.metadata (6.7 kB)\nCollecting jinja2 (from torch==2.6.0+cpu)\n  Downloading jinja2-3.1.6-py3-none-any.whl.metadata (2.9 kB)\nCollecting fsspec (from torch==2.6.0+cpu)\n  Downloading fsspec-2026.9.0-py3-none-any.whl.metadata (10 kB)\nCollecting setuptools (from torch==2.6.0+cpu)\n  Downloading setuptools-84.0.0-py3-none-any.whl.metadata (6.6 kB)\nCollecting sympy==1.13.1 (from torch==2.6.0+cpu)\n  Downloading sympy-1.13.1-py3-none-any.whl.metadata (12 kB)\nCollecting mpmath<1.4,>=1.1.0 (from sympy==1.13.1->torch==2.6.0+cpu)\n  Downloading mpmath-1.3.0-py3-none-any.whl.metadata (8.6 kB)\nCollecting MarkupSafe>=2.0 (from jinja2->torch==2.6.0+cpu)\n  Downloading markupsafe-3.0.4-cp312-cp312-manylinux2014_x86_64.manylinux_2_17_x86_64.manylinux_2_28_x86_64.whl.metadata (2.7 kB)\nDownloading https://download-r2.pytorch.org/whl/cpu/torch-2.6.0%2Bcpu-cp312-cp312-linux_x86_64.whl (178.6 MB)\n   ━━━━━━━━━━━━━━━━━━━━━━━━━━━━━━━━━━━━━━━ 178.6/178.6 MB 288.6 MB/s eta 0:00:00\nDownloading https://download-r2.pytorch.org/whl/cpu/torchaudio-2.6.0%2Bcpu-cp312-cp312-linux_x86_64.whl (1.7 MB)\n   ━━━━━━━━━━━━━━━━━━━━━━━━━━━━━━━━━━━━━━━━ 1.7/1.7 MB 230.5 MB/s eta 0:00:00\nDownloading sympy-1.13.1-py3-none-any.whl (6.2 MB)\n   ━━━━━━━━━━━━━━━━━━━━━━━━━━━━━━━━━━━━━━━━ 6.2/6.2 MB 275.2 MB/s eta 0:00:00\nDownloading typing_extensions-4.16.0-py3-none-any.whl (45 kB)\n   ━━━━━━━━━━━━━━━━━━━━━━━━━━━━━━━━━━━━━━━━ 45.6/45.6 kB 233.3 MB/s eta 0:00:00\nDownloading filelock-4.1.0-py3-none-any.whl (133 kB)\n   ━━━━━━━━━━━━━━━━━━━━━━━━━━━━━━━━━━━━━━━ 133.0/133.0 kB 302.2 MB/s eta 0:00:00\nDownloading fsspec-2026.9.0-py3-none-any.whl (221 kB)\n   ━━━━━━━━━━━━━━━━━━━━━━━━━━━━━━━━━━━━━━━ 221.7/221.7 kB 334.7 MB/s eta 0:00:00\nDownloading jinja2-3.1.6-py3-none-any.whl (134 kB)\n   ━━━━━━━━━━━━━━━━━━━━━━━━━━━━━━━━━━━━━━━ 134.9/134.9 kB 316.9 MB/s eta 0:00:00\nDownloading networkx-3.7-py3-none-any.whl (2.1 MB)\n   ━━━━━━━━━━━━━━━━━━━━━━━━━━━━━━━━━━━━━━━━ 2.1/2.1 MB 295.6 MB/s eta 0:00:00\nDownloading setuptools-84.0.0-py3-none-any.whl (818 kB)\n   ━━━━━━━━━━━━━━━━━━━━━━━━━━━━━━━━━━━━━━━ 818.2/818.2 kB 346.8 MB/s eta 0:00:00\nDownloading markupsafe-3.0.4-cp312-cp312-manylinux2014_x86_64.manylinux_2_17_x86_64.manylinux_2_28_x86_64.whl (22 kB)\nDownloading mpmath-1.3.0-py3-none-any.whl (536 kB)\n   ━━━━━━━━━━━━━━━━━━━━━━━━━━━━━━━━━━━━━━━ 536.2/536.2 kB 341.3 MB/s eta 0:00:00\nInstalling collected packages: mpmath, typing-extensions, sympy, setuptools, networkx, MarkupSafe, fsspec, filelock, jinja2, torch, torchaudio\nSuccessfully installed MarkupSafe-3.0.4 filelock-4.1.0 fsspec-2026.9.0 jinja2-3.1.6 mpmath-1.3.0 networkx-3.7 setuptools-84.0.0 sympy-1.13.1 torch-2.6.0+cpu torchaudio-2.6.0+cpu typing-extensions-4.16.0\n"
    },
    {
      "id": "install_engine",
      "returncode": 0,
      "status": "PASS",
      "stderr_tail": "",
      "stdout_tail": "Collecting qwen-tts==0.1.1\n  Downloading qwen_tts-0.1.1-py3-none-any.whl.metadata (61 kB)\n     ━━━━━━━━━━━━━━━━━━━━━━━━━━━━━━━━━━━━━━━ 61.4/61.4 kB 130.4 MB/s eta 0:00:00\nCollecting transformers==4.57.3\n  Downloading transformers-4.57.3-py3-none-any.whl.metadata (43 kB)\n     ━━━━━━━━━━━━━━━━━━━━━━━━━━━━━━━━━━━━━━━ 44.0/44.0 kB 190.9 MB/s eta 0:00:00\nCollecting accelerate==1.12.0\n  Downloading accelerate-1.12.0-py3-none-any.whl.metadata (19 kB)\nCollecting gradio\n  Downloading gradio-6.30.0-py3-none-any.whl.metadata (16 kB)\nCollecting librosa\n  Downloading librosa-1.0.0-py3-none-any.whl.metadata (6.7 kB)\nCollecting soundfile\n  Downloading soundfile-0.14.0-py2.py3-none-manylinux_2_28_x86_64.whl.metadata (18 kB)\nCollecting sox\n  Downloading sox-1.5.0.tar.gz (63 kB)\n     ━━━━━━━━━━━━━━━━━━━━━━━━━━━━━━━━━━━━━━━ 63.9/63.9 kB 224.4 MB/s eta 0:00:00\n  Installing build dependencies: started\n  Installing build dependencies: finished with status 'done'\n  Getting requirements to build wheel: started\n  Getting requirements to build wheel: finished with status 'done'\n  Preparing metadata (pyproject.toml): started\n  Preparing metadata (pyproject.toml): finished with status 'done'\nCollecting onnxruntime\n  Downloading onnxruntime-1.31.0-cp312-cp312-manylinux_2_28_x86_64.whl.metadata (5.7 kB)\nCollecting einops\n  Downloading einops-0.8.2-py3-none-any.whl.metadata (13 kB)\nRequirement already satisfied: torchaudio in /workspace/voiceover_qwen_cpu_py312/lib/python3.12/site-packages (from qwen-tts==0.1.1) (2.6.0+cpu)\nRequirement already satisfied: filelock in /workspace/voiceover_qwen_cpu_py312/lib/python3.12/site-packages (from transformers==4.57.3) (4.1.0)\nCollecting huggingface-hub<1.0,>=0.34.0 (from transformers==4.57.3)\n  Downloading huggingface_hub-0.36.2-py3-none-any.whl.metadata (15 kB)\nCollecting numpy>=1.17 (from transformers==4.57.3)\n  Downloading numpy-2.5.3-cp312-cp312-manylinux_2_27_x86_64.manylinux_2_28_x86_64.whl.metadata (6.6 kB)\nCollecting packaging>=20.0 (from transformers==4.57.3)\n  Downloading packaging-26.3-py3-none-any.whl.metadata (3.5 kB)\nCollecting pyyaml>=5.1 (from transformers==4.57.3)\n  Downloading pyyaml-6.0.3-cp312-cp312-manylinux2014_x86_64.manylinux_2_17_x86_64.manylinux_2_28_x86_64.whl.metadata (2.4 kB)\nCollecting regex!=2019.12.17 (from transformers==4.57.3)\n  Downloading regex-2026.9.29-cp312-cp312-manylinux2014_x86_64.manylinux_2_17_x86_64.manylinux_2_28_x86_64.whl.metadata (40 kB)\n     ━━━━━━━━━━━━━━━━━━━━━━━━━━━━━━━━━━━━━━━ 40.6/40.6 kB 246.5 MB/s eta 0:00:00\nCollecting requests (from transformers==4.57.3)\n  Downloading requests-2.34.2-py3-none-any.whl.metadata (4.8 kB)\nCollecting tokenizers<=0.23.0,>=0.22.0 (from transformers==4.57.3)\n  Downloading tokenizers-0.22.2-cp39-abi3-manylinux_2_17_x86_64.manylinux2014_x86_64.whl.metadata (7.3 kB)\nCollecting safetensors>=0.4.3 (from transformers==4.57.3)\n  Downloading safetensors-0.8.0-cp310-abi3-manylinux_2_17_x86_64.manylinux2014_x86_64.whl.metadata (4.2 kB)\nCollecting tqdm>=4.27 (from transformers==4.57.3)\n  Downloading tqdm-4.70.1-py3-none-any.whl.metadata (57 kB)\n     ━━━━━━━━━━━━━━━━━━━━━━━━━━━━━━━━━━━━━━━ 57.4/57.4 kB 247.4 MB/s eta 0:00:00\nCollecting psutil (from accelerate==1.12.0)\n  Downloading psutil-7.2.2-cp36-abi3-manylinux2010_x86_64.manylinux_2_12_x86_64.manylinux_2_28_x86_64.whl.metadata (22 kB)\nRequirement already satisfied: torch>=2.0.0 in /workspace/voiceover_qwen_cpu_py312/lib/python3.12/site-packages (from accelerate==1.12.0) (2.6.0+cpu)\nCollecting anyio<5.0,>=3.0 (from gradio)\n  Downloading anyio-4.15.1-py3-none-any.whl.metadata (4.7 kB)\nCollecting brotli>=1.1.0 (from gradio)\n  Downloading brotli-1.2.0-cp312-cp312-manylinux2014_x86_64.manylinux_2_17_x86_64.whl.metadata (6.1 kB)\nCollecting fastapi<1.0,>=0.115.2 (from gradio)\n  Downloading fastapi-0.143.0-py3-none-any.whl.metadata (26 kB)\nCollecting gradio-client==2.7.2 (from gradio)\n  Downloading gradio_client-2.7.2-py3-none-any.whl.metadata (7.1 kB)\nCollecting groovy~=0.1 (from gradio)\n  Downloading groovy-0.1.2-py3-none-any.whl.metadata (6.1 kB)\nCollecting hf-gradio<1.0,>=0.4.1 (from gradio)\n  Downloading hf_gradio-0.4.1-py3-none-any.whl.metadata (428 bytes)\nCollecting httpx<1.0,>=0.24.1 (from gradio)\n  Downloading httpx-0.28.1-py3-none-any.whl.metadata (7.1 kB)\nINFO: pip is looking at multiple versions of gradio to determine which version is compatible with other requirements. This could take a while.\nCollecting gradio\n  Downloading gradio-6.29.1-py3-none-any.whl.metadata (16 kB)\n  Downloading gradio-6.29.0-py3-none-any.whl.metadata (16 kB)\nCollecting gradio-client==2.7.1 (from gradio)\n  Downloading gradio_client-2.7.1-py3-none-any.whl.metadata (7.1 kB)\nCollecting gradio\n  Downloading gradio-6.28.0-py3-none-any.whl.metadata (16 kB)\n  Downloading gradio-6.27.0-py3-none-any.whl.metadata (17 kB)\nCollecting gradio-client==2.7.0 (from gradio)\n  Downloading gradio_client-2.7.0-py3-none-any.whl.metadata (7.1 kB)\nCollecting gradio\n  Downloading gradio-6.26.0-py3-none-any.whl.metadata (17 kB)\nCollecting gradio-client==2.6.1 (from gradio)\n  Downloading gradio_client-2.6.1-py3-none-any.whl.metadata (7.1 kB)\nCollecting gradio\n  Downloading gradio-6.25.0-py3-none-any.whl.metadata (17 kB)\nCollecting gradio-client==2.6.0 (from gradio)